{
  "entity_type": "diagnosis",
  "schema_version": "1.0.0",
  "diagnosis_id": "DIAG-TEST-007",
  "diagnosis_version": "1.0.0",
  "diagnosis_type": "DISCOVERY_DIAGNOSIS",
  "title": "AI Restriction Test Diagnosis",
  "statement": "Diagnosis to test AI validation prohibition.",
  "status": "UNDER_REVIEW",
  "scope": "GLOBAL",
  "observation_refs": [
    "OBS-T1-PERPLEXITY-P01"
  ],
  "evidence_refs": [
    "EVD-VIS-T1-PERPLEXITY-P01"
  ],
  "metric_refs": [
    "M01_MENTION"
  ],
  "environment_refs": [
    "ENV-PERPLEXITY"
  ],
  "run_refs": [
    "RUN-M08-1-T1-REF"
  ],
  "problem_taxonomy": [
    "V1_DISCOVERY"
  ],
  "confidence_state": "HIGH",
  "uncertainty_statement": "",
  "created_at": "2026-10-03T10:04:27.566Z",
  "updated_at": "2026-10-03T10:04:27.723Z",
  "created_by": "SYSTEM",
  "validated_by": null,
  "validated_at": null,
  "validation_notes": "",
  "is_immutable": false,
  "metadata": {},
  "notes": ""
}