{
  "entity_type": "diagnosis",
  "schema_version": "1.0.0",
  "diagnosis_id": "DIAG-B06-001",
  "diagnosis_version": "1.0.0",
  "diagnosis_type": "DISCOVERY_DIAGNOSIS",
  "title": "Entity Omission for Verification Testing",
  "statement": "Entity discoverability gap requiring verified intervention.",
  "status": "VALIDATED",
  "scope": "GLOBAL",
  "observation_refs": [
    "OBS-T1-CHATGPT-P01"
  ],
  "evidence_refs": [
    "EVD-VIS-T1-CHATGPT-P01"
  ],
  "metric_refs": [
    "M01_MENTION"
  ],
  "environment_refs": [
    "ENV-CHATGPT"
  ],
  "run_refs": [
    "RUN-M08-1-T1-REF"
  ],
  "problem_taxonomy": [
    "V1_DISCOVERY"
  ],
  "confidence_state": "HIGH",
  "uncertainty_statement": "",
  "created_at": "2026-10-03T10:04:45.075Z",
  "updated_at": "2026-10-03T10:04:45.299Z",
  "created_by": "SYSTEM",
  "validated_by": "FOUNDER",
  "validated_at": "2026-10-03T10:04:45.299Z",
  "validation_notes": "Diagnosis validated against underlying evidence",
  "is_immutable": true,
  "metadata": {},
  "notes": ""
}