{
  "entity_type": "diagnosis",
  "schema_version": "1.0.0",
  "diagnosis_id": "DIAG-TEST-012-UNVAL",
  "diagnosis_version": "1.0.0",
  "diagnosis_type": "DISCOVERY_DIAGNOSIS",
  "title": "Unvalidated Diagnosis",
  "statement": "This diagnosis has not been validated by Founder.",
  "status": "DETECTED",
  "scope": "GLOBAL",
  "observation_refs": [
    "OBS-T1-CHATGPT-P01"
  ],
  "evidence_refs": [
    "EVD-VIS-T1-CHATGPT-P01"
  ],
  "metric_refs": [
    "M01_MENTION"
  ],
  "environment_refs": [
    "ENV-CHATGPT"
  ],
  "run_refs": [
    "RUN-M08-1-T1-REF"
  ],
  "problem_taxonomy": [
    "V1_DISCOVERY"
  ],
  "confidence_state": "HIGH",
  "uncertainty_statement": "",
  "created_at": "2026-10-03T10:04:28.178Z",
  "updated_at": null,
  "created_by": "SYSTEM",
  "validated_by": null,
  "validated_at": null,
  "validation_notes": "",
  "is_immutable": false,
  "metadata": {},
  "notes": ""
}